<?xml version="1.0" encoding="UTF-8"?>

<!DOCTYPE contact SYSTEM "contact.dtd">

<contact familyMember="no">
    <name>John</name>
    <lastName>Smith</lastName>
    <mobileNum>6551245</mobileNum>
    <landlineNum>45879542</landlineNum>
    <age>42</age>
    <address main="yes">
        <street></street>
        <postalCode></postalCode>
        <city></city>
    </address>
    <email>johnsmith@gmail.com</email>
</contact>
<contact familyMember="yes">
    <name>Maria</name>
    <lastName>Martinez</lastName>
    <mobileNum>611254875</mobileNum>
    <landlineNum>47090140</landlineNum>
    <age>25</age>
    <address main="no">Talcahuano 1323</address>
    <email>mmariamartinez12@hotmail.com</email>
</contact>